{
  "$id": "Ek6vA-fVXDRbraVi7a9ydKStHiByUoF37Cgz4L58LWds",
  "$schema": "http://json-schema.org/draft-07/schema#",
  "title": "GLEIFvLEICredential",
  "type": "object",
  "properties": {
    "v": {
      "type": "string"
    },
    "i": {
      "type": "string"
    },
    "ti": {
      "type": "string"
    },
    "x": {
      "description": "schema block",
      "type": "string"
    },
    "d": {
      "description": "data block",
      "properties": {
        "i": {
          "type": "string"
        },
        "si": {
          "type": "string"
        },
        "issuanceDate": {
          "format": "date-time",
          "type": "string"
        },
        "credentialStatus": {
          "type": "string"
        },
        "LEI": {
          "type": "string"
        },
        "type": {
          "contains": {
            "const": "GLEIFvLEICredential"
          },
          "type": "array"
        }
      },
      "additionalProperties": false,
      "required": [
        "i",
        "issuanceDate",
        "credentialStatus",
        "LEI",
        "type"
      ],
      "type": "object"
    }
  },
  "additionalProperties": false,
  "required": [
    "i",
    "d"
  ]
}