{
  "v": "ACDC10JSON00011c_",
  "i": "Esmy31gPoOJzxv2JwpGBb_zJ7XkNUVYZZheMifW89CQY",
  "ti": "did:keri:ELzvA4arGVUFitOpSCjWvmpfVzTmJR4wIVnsnRtlCPG",
  "x": "Ek6vA-fVXDRbraVi7a9ydKStHiByUoF37Cgz4L58LWds",
  "d": {
    "i": "ErmVM5JGLewHJrSqIuhwWktoIlfffh7sHIGAQvtcFSU",
    "si": "did:keri:Eky8a1Xo48shGZobJA2C_NGVXK59P04mY9QmWEbflHBM",
    "issuanceDate": "2021-06-09T17:35:54.169967+00:00",
    "credentialStatus": "did:keri:EymRy7xMwsxUelUauaXtMxTfPAMPAI6FkekwlOjkggt",
    "LEI": "254900OPPU84GM83MG36",
    "type": [
      "VerifiableCredential",
      "GLEIFvLEICredential"
    ]
  }
}
