{
  "v": "ACDC10JSON00011c_",
  "i": "EYo4R9I08Et5H5SWKG8ZMS83r8FmRtfahN0V9NbG9zdw",
  "ti": "did:keri:Ei5csblWpTy22uVkbZrZxvSUORxPvIlrfpq2e1hKTtfA",
  "x": "ECcj1CBn4dpo6ZOmZQNtAjXxT4_MsVXipt5VTPjvSAf0",
  "d": {
    "i": "Ea4ny_YZAtAGUwGSyH7iFiKjpM3yFiDHcjrdomqt7Ryk",
    "si": "did:keri:EP2ukuiw_0xcp943NWz4IRnNtxwx7rzROwV1D_ZRP0XQ",
    "issuanceDate": "2021-06-09T17:35:54.169967+00:00",
    "credentialStatus": "did:keri:EymRy7xMwsxUelUauaXtMxTfPAMPAI6FkekwlOjkggt",
    "LEI": "5493001KJTIIGC8Y1R12",
    "type": [
      "VerifiableCredential",
      "QualifiedvLEIIssuervLEICredential"
    ]
  }
}
